{
	"schemaVersion": 2,
	"id": "M02741",
	"sefariaHeadword": "מְרָעִיתָא",
	"headwords": [
		{
			"text": "מְרָעִיתָא"
		}
	],
	"display": "{0}",
	"page": {
		"number": 845,
		"column": "b"
	},
	"senses": [
		{
			"gloss": ", v. <cite ref=\"M02730\"><he>מְרַע</he> II</cite>",
			"units": []
		}
	]
}
