{
	"schemaVersion": 2,
	"id": "N00345",
	"sefariaHeadword": "נוֹחֵשׁ",
	"headwords": [
		{
			"text": "נוֹחֵשׁ"
		}
	],
	"display": "{0}",
	"page": {
		"number": 886,
		"column": "b"
	},
	"senses": [
		{
			"gloss": "<i>,</i> pl. <he>נוֹחֲשִׁים</he>, v. <cite ref=\"N00518\"><he>נָחַשׁ</he></cite>.",
			"units": []
		}
	]
}
