{
	"schemaVersion": 2,
	"id": "C00211",
	"sefariaHeadword": "גְּדִין",
	"headwords": [
		{
			"text": "גְּדִין"
		}
	],
	"display": "{0}",
	"page": {
		"number": 212,
		"column": "a"
	},
	"senses": [
		{
			"gloss": ", v. <cite ref=\"C00192\"><he>גְּדִי</he></cite> ch.—[<cite ref=\"Targum Jonathan on Numbers 22:7\">Targ. Y. Num. XXII, 7</cite> Ar., read <he>אִגְּרִין</he>.]",
			"units": []
		}
	]
}
