{
	"schemaVersion": 2,
	"id": "A01612",
	"sefariaHeadword": "אֶירֶס",
	"headwords": [
		{
			"text": "אֶירֶס"
		},
		{
			"text": "אֵירְסָא"
		}
	],
	"display": "{0}, {1}",
	"page": {
		"number": 60,
		"column": "b"
	},
	"senses": [
		{
			"gloss": ", v. <cite ref=\"A03208\"><he>אֶרֶס</he></cite>",
			"units": []
		}
	]
}
