{
	"schemaVersion": 2,
	"id": "T00196",
	"sefariaHeadword": "רְגִימָא",
	"headwords": [
		{
			"text": "רְגִימָא"
		},
		{
			"text": "רְגִימְתָּא"
		}
	],
	"display": "{0}, {1}",
	"page": {
		"number": 1448,
		"column": "b"
	},
	"grammar": {
		"gender": "f"
	},
	"senses": [
		{
			"gloss": "f. (<cite ref=\"T00212\"><he>רְגַם</he></cite>), <he>רְגִימַת אבנין</he> <i>throwing of stones, stoning</i>. ",
			"units": [
				"<cite ref=\"Aramaic Targum to Ruth 1:17\">Targ. Ruth I, 17</cite>."
			]
		}
	]
}
