{
	"schemaVersion": 2,
	"id": "S00731",
	"sefariaHeadword": "קְטוּתָא",
	"headwords": [
		{
			"text": "קְטוּתָא"
		},
		{
			"text": "קְטוּ"
		}
	],
	"display": "{0}, {1}",
	"page": {
		"number": 1347,
		"column": "a"
	},
	"grammar": {
		"gender": "f"
	},
	"senses": [
		{
			"gloss": "f. (<cite ref=\"S00685\"><he>קְטָא</he></cite>) <i>branch, switch</i>. ",
			"units": [
				"<cite ref=\"Eichah Rabbah 1:50\">Lam. R. to I, 3</cite> (some ed. <cite ref=\"S00773\"><he>קְטִיתָא</he></cite>); <cite ref=\"Bamidbar Rabbah 12:3\">Num. R. s. 12</cite>."
			]
		}
	]
}
