{
	"schemaVersion": 2,
	"id": "A03442",
	"sefariaHeadword": "אִתְקְפָדַת",
	"headwords": [
		{
			"text": "אִתְקְפָדַת"
		}
	],
	"display": "{0}",
	"page": {
		"number": 133,
		"column": "b"
	},
	"grammar": {
		"gender": "f"
	},
	"senses": [
		{
			"gloss": "f. (<he>קפד</he>) <i>cutting off, destruction</i>. ",
			"units": [
				"<cite ref=\"Targum Jonathan on Ezekiel 7:25\">Targ. Ezek. VII, 25</cite>."
			]
		}
	]
}
