{
	"schemaVersion": 2,
	"id": "M02556",
	"sefariaHeadword": "מַרְדְּעָא",
	"headwords": [
		{
			"text": "מַרְדְּעָא"
		}
	],
	"display": "{0}",
	"page": {
		"number": 837,
		"column": "b"
	},
	"grammar": {
		"gender": "f"
	},
	"senses": [
		{
			"gloss": "f. (Syr. <he>ברדעתא</he>, P. Sm. 604; Arab. barḍaʿat, v. Fr. Aram. Fremdw., p. 104) <i>a garment made up of patches</i>. ",
			"units": [
				"<cite ref=\"Eichah Rabbah 1:1\">Lam. R. to I, 1</cite> <cite ref=\"T00152\"><he>רבתי</he></cite> (<he>חד כות׳</he> 1) <he>מ׳ אית ליה וכ׳</he> (ed. Wil. <he>מדר׳</he>, corr. acc.) he has a garment made up of twenty four patches, v. <he>אִיסְטְחָא</he> II"
			]
		}
	]
}
