{
	"schemaVersion": 2,
	"id": "G00729",
	"sefariaHeadword": "זַרְעִית",
	"headwords": [
		{
			"text": "זַרְעִית"
		}
	],
	"display": "{0}",
	"page": {
		"number": 414,
		"column": "b"
	},
	"grammar": {
		"gender": "f"
	},
	"senses": [
		{
			"gloss": "f. (<cite ref=\"G00728\">preced.</cite> wds.) <i>descendants, family</i>.—Pl. <he>זַרְעִיּוֹת</he>. ",
			"units": [
				"<cite ref=\"Mishnah Sanhedrin 4:5\">Snh. IV, 5</cite> (<cite ref=\"Sanhedrin 37a:11\">37ᵃ</cite>) <he>דמו ודם זַרְעִיּוֹתָיו</he> Mish. a. Y. ed. (Bab. ed. <he>זרעותיו</he>, v. Rabb. D. S. a. l. note 10) his own (the murdered man’s) blood and that of his eventual descendants; <cite ref=\"Bereishit Rabbah 22\">Gen. R. s. 22</cite>; <cite ref=\"Yalkut Shimoni on Torah 38:3\">Yalk. Gen. 38</cite>."
			]
		}
	]
}
