{
	"schemaVersion": 2,
	"id": "U01047",
	"sefariaHeadword": "שִׁיקּוּר II",
	"headwords": [
		{
			"text": "שִׁיקּוּר",
			"homograph": 2
		}
	],
	"display": "{0} II",
	"page": {
		"number": 1567,
		"column": "b"
	},
	"grammar": {
		"gender": "m"
	},
	"senses": [
		{
			"gloss": "m. name of an <i>earthen vessel</i> (prob. a tumbler that cannot stand, v. ",
			"units": [
				"<cite ref=\"Shabbat 104a\">Sabb. 104ᵃ</cite> quot. s. v. <cite ref=\"U01897\"><he>שִׁקְרָא</he></cite>).—<i>Pl.</i> <he>שִׁקּוּרִין</he>. ",
				"<cite ref=\"Tosefta Kelim Kamma 2:9\">Tosef. Kel. B. Kam. II, 9</cite> ed. Zuck. (oth. ed. <cite ref=\"U01840\"><he>שקורי</he></cite>; R. S. to <cite ref=\"Mishnah Kelim 3:2\">Kel. III, 2</cite> <cite ref=\"U01039\"><he>שִׁקּוּדִין</he></cite>)."
			]
		}
	]
}
