{
	"schemaVersion": 2,
	"id": "N00528",
	"sefariaHeadword": "נַחְשִׁירְכָן",
	"headwords": [
		{
			"text": "נַחְשִׁירְכָן"
		},
		{
			"text": "נַחְשִׁרְ׳",
			"partial": true
		}
	],
	"display": "{0}, {1}",
	"page": {
		"number": 897,
		"column": "a"
	},
	"senses": [
		{
			"gloss": " (not <he>נחשיד׳</he>) m. (Pers., v. Nöld. Mand. Gramm. p. 63) <i>hunter; a shrewd man</i>. ",
			"units": [
				"<cite ref=\"Onkelos Genesis 25:27\">Targ. Gen. XXV, 27</cite> (h. text <he>ידע ציד</he>; cmp. ",
				"<cite ref=\"Bereishit Rabbah 63\">Gen. R. s. 63</cite>; Tanḥ. Tol’doth 8)."
			]
		}
	]
}
