{
	"schemaVersion": 2,
	"id": "M01939",
	"sefariaHeadword": "מָסַךְ II",
	"headwords": [
		{
			"text": "מָסַךְ",
			"homograph": 2
		}
	],
	"display": "{0} II",
	"page": {
		"number": 807,
		"column": "a"
	},
	"senses": [
		{
			"gloss": "(b. h.; denom. of <cite ref=\"M01943\"><he>מַסֵּכָה</he> I</cite>) <i>to cast</i> (<i>metal</i>). ",
			"units": [
				"<cite ref=\"Jerusalem Talmud Berakhot 1:1:30\">Y. Ber. I, 2ᵈ</cite> top; <cite ref=\"Bereishit Rabbah 12\">Gen. R. s. 12</cite>, end <he>מוֹסֵךְ</he> Ar. (ed. Y. Ber. <he>נוֹסֵךְ</he>; Gen. R. <he>מוֹצֵק</he>), v. <cite ref=\"B00270\"><he>בּוּלָס</he></cite>.—[<cite ref=\"Yalkut Shimoni on Torah 165:2\">Yalk. Ex. 165</cite> <he>ממסכת</he>, read <cite ref=\"M01955\"><he>מֵסֶכֶת</he></cite>, v. <cite ref=\"O00294\"><he>סוּךְ</he></cite>.]"
			]
		}
	]
}
